{
  "active_track": "none",
  "cases": {
    "a": {
      "path": "cases/a",
      "retired": false,
      "title": "Language assistance"
    },
    "b": {
      "path": "cases/b",
      "retired": false,
      "title": "Discount transactions"
    }
  },
  "created_at": "2026-09-13T16:07:06Z",
  "last_completed_operation_id": "followup-b",
  "layout_version": 2,
  "links": [],
  "manifest_revision": 7,
  "next_action": "Investigate cases.",
  "open_blockers": [],
  "project_id": "topic",
  "schema_version": "1.0",
  "selection": null,
  "selection_generation": 0,
  "slug": "topic",
  "title": "Synthetic language service comparison",
  "updated_at": "2026-09-13T16:07:07Z"
}
